{
  "$schema": "https://json-schema.org/draft/2020-12/schema",
  "title": "FLOW urbanism — structured backlog and qualified releases",
  "type": "object",
  "properties": {
    "schema_version": {
      "const": "1.0.0"
    },
    "model_id": {
      "const": "flow-urbanism"
    },
    "version": {
      "type": "string",
      "minLength": 1
    },
    "space": {
      "enum": [
        "backlog",
        "release"
      ]
    },
    "as_of": {
      "type": "string",
      "pattern": "^\\d{4}-\\d{2}-\\d{2}$"
    },
    "source_version": {
      "type": "string",
      "minLength": 1
    },
    "source_files": {
      "type": "array",
      "items": {
        "type": "object",
        "properties": {
          "path": {
            "type": "string",
            "minLength": 1
          },
          "sha256": {
            "type": "string",
            "pattern": "^[0-9a-f]{64}$"
          }
        },
        "required": [
          "path",
          "sha256"
        ],
        "additionalProperties": false
      }
    },
    "nodes": {
      "type": "array",
      "items": {
        "$ref": "#/$defs/node"
      }
    },
    "relations": {
      "type": "array",
      "items": {
        "$ref": "#/$defs/relation"
      }
    },
    "principles": {
      "type": "array",
      "items": {
        "type": "object",
        "properties": {
          "id": {
            "type": "string",
            "minLength": 1
          },
          "statement": {
            "type": "string",
            "minLength": 1
          },
          "source_refs": {
            "type": "array",
            "items": {
              "type": "string",
              "minLength": 1
            },
            "uniqueItems": true
          },
          "revision": {
            "type": "integer"
          },
          "last_modified": {
            "type": "string",
            "pattern": "^\\d{4}-\\d{2}-\\d{2}T\\d{2}:\\d{2}:\\d{2}(\\.\\d+)?Z$"
          },
          "content_sha256": {
            "type": "string",
            "pattern": "^[0-9a-f]{64}$"
          }
        },
        "required": [
          "id",
          "statement",
          "source_refs"
        ],
        "additionalProperties": false
      }
    },
    "limitations": {
      "type": "array",
      "items": {
        "type": "string"
      }
    },
    "alternatives": {
      "type": "array",
      "items": {
        "type": "object",
        "properties": {
          "id": {
            "type": "string",
            "minLength": 1
          },
          "kind": {
            "enum": [
              "alternative_decomposition",
              "alternative_labels"
            ]
          },
          "target_id": {
            "type": "string",
            "minLength": 1
          },
          "state": {
            "const": "proposed"
          },
          "source_refs": {
            "type": "array",
            "items": {
              "type": "string",
              "minLength": 1
            },
            "uniqueItems": true
          },
          "note": {
            "type": "string"
          },
          "members": {
            "type": "array",
            "items": {
              "type": "object",
              "properties": {
                "name": {
                  "type": "string",
                  "minLength": 1
                },
                "definition": {
                  "type": "string",
                  "minLength": 1
                },
                "finality": {
                  "type": "string",
                  "minLength": 1
                },
                "legacy_alignment": {
                  "type": "string"
                }
              },
              "required": [
                "name",
                "definition",
                "finality",
                "legacy_alignment"
              ],
              "additionalProperties": false
            }
          },
          "field_overrides": {
            "type": "array",
            "items": {
              "type": "object",
              "properties": {
                "target_id": {
                  "type": "string",
                  "minLength": 1
                },
                "field": {
                  "type": "string",
                  "minLength": 1
                },
                "value": {
                  "type": "string",
                  "minLength": 1
                }
              },
              "required": [
                "target_id",
                "field",
                "value"
              ],
              "additionalProperties": false
            }
          }
        },
        "required": [
          "id",
          "kind",
          "target_id",
          "state",
          "source_refs",
          "note"
        ],
        "additionalProperties": false
      }
    },
    "release_kind": {
      "enum": [
        "partial_baseline",
        "published_snapshot"
      ]
    },
    "excluded_nodes": {
      "type": "array",
      "items": {
        "type": "object",
        "properties": {
          "id": {
            "type": "string",
            "minLength": 1
          },
          "reason": {
            "type": "string",
            "minLength": 1
          },
          "source_refs": {
            "type": "array",
            "items": {
              "type": "string",
              "minLength": 1
            },
            "uniqueItems": true
          }
        },
        "required": [
          "id",
          "reason",
          "source_refs"
        ],
        "additionalProperties": false
      }
    },
    "publication": {
      "type": "object",
      "properties": {
        "source_refs": {
          "type": "array",
          "items": {
            "type": "string",
            "minLength": 1
          },
          "minItems": 1,
          "uniqueItems": true
        },
        "note": {
          "type": "string"
        }
      },
      "required": [
        "source_refs",
        "note"
      ],
      "additionalProperties": false
    },
    "revision": {
      "type": "integer"
    },
    "last_modified": {
      "type": "string",
      "pattern": "^\\d{4}-\\d{2}-\\d{2}T\\d{2}:\\d{2}:\\d{2}(\\.\\d+)?Z$"
    },
    "content_sha256": {
      "type": "string",
      "pattern": "^[0-9a-f]{64}$"
    },
    "element_versioning": {
      "const": 1
    },
    "lifecycle_policy": {
      "const": 1
    },
    "glossary": {
      "type": "object",
      "properties": {
        "terms": {
          "type": "array",
          "items": {
            "type": "object"
          }
        }
      },
      "required": [
        "terms"
      ],
      "additionalProperties": true
    }
  },
  "required": [
    "schema_version",
    "model_id",
    "version",
    "space",
    "as_of",
    "source_version",
    "source_files",
    "nodes",
    "relations",
    "principles",
    "limitations"
  ],
  "additionalProperties": false,
  "$defs": {
    "node": {
      "type": "object",
      "properties": {
        "id": {
          "type": "string",
          "minLength": 1
        },
        "revision": {
          "type": "integer"
        },
        "kind": {
          "enum": [
            "domain",
            "reference",
            "group",
            "capability",
            "behavior",
            "object",
            "document",
            "event"
          ]
        },
        "layer": {
          "description": "Marqueur historique, retiré du modèle métier depuis U455 ; conservé pour lire les publications anciennes.",
          "enum": [
            "transactional",
            "process"
          ]
        },
        "fields": {
          "type": "object",
          "properties": {
            "name": {
              "type": "string"
            },
            "definition": {
              "type": "string"
            },
            "finality": {
              "type": "string"
            },
            "scope": {
              "type": "string"
            },
            "nature": {
              "type": "string"
            },
            "independence": {
              "type": "string"
            },
            "mastership": {
              "type": "string"
            },
            "decomposition_rationale": {
              "type": "string"
            },
            "market_comparisons": {
              "$ref": "#/$defs/marketComparisons"
            }
          },
          "required": [],
          "additionalProperties": false
        },
        "source_refs": {
          "type": "array",
          "items": {
            "type": "string",
            "minLength": 1
          },
          "uniqueItems": true
        },
        "source_locator": {
          "type": "object",
          "properties": {
            "path": {
              "type": "string",
              "minLength": 1
            },
            "anchor": {
              "type": "string"
            },
            "line": {
              "type": "integer"
            }
          },
          "required": [
            "path",
            "anchor"
          ],
          "additionalProperties": false
        },
        "review": {
          "type": "object",
          "properties": {
            "state": {
              "enum": [
                "proposed",
                "accepted",
                "partial",
                "under_review",
                "illustration"
              ]
            },
            "note": {
              "type": "string"
            }
          },
          "required": [
            "state",
            "note"
          ],
          "additionalProperties": false
        },
        "editorial_basis": {
          "type": "string"
        },
        "adoption_ids": {
          "type": "array",
          "items": {
            "type": "string",
            "minLength": 1
          },
          "uniqueItems": true
        },
        "missing_fields": {
          "type": "array",
          "items": {
            "type": "string",
            "minLength": 1
          },
          "uniqueItems": true
        },
        "approved_fields": {
          "type": "array",
          "items": {
            "type": "string",
            "minLength": 1
          },
          "uniqueItems": true
        },
        "proposed_fields": {
          "type": "array",
          "items": {
            "type": "string",
            "minLength": 1
          },
          "uniqueItems": true
        },
        "group_role": {
          "enum": [
            "presentation",
            "urbanism_level"
          ]
        },
        "level_ref": {
          "type": "string",
          "minLength": 1
        },
        "last_modified": {
          "type": "string",
          "pattern": "^\\d{4}-\\d{2}-\\d{2}T\\d{2}:\\d{2}:\\d{2}(\\.\\d+)?Z$"
        },
        "content_sha256": {
          "type": "string",
          "pattern": "^[0-9a-f]{64}$"
        },
        "lifecycle": {
          "$ref": "#/$defs/lifecycle"
        }
      },
      "required": [
        "id",
        "revision",
        "kind",
        "fields",
        "source_refs",
        "source_locator",
        "review"
      ],
      "additionalProperties": false
    },
    "relation": {
      "type": "object",
      "properties": {
        "id": {
          "type": "string",
          "minLength": 1
        },
        "revision": {
          "type": "integer"
        },
        "type": {
          "type": "string",
          "minLength": 1
        },
        "source_id": {
          "type": "string",
          "minLength": 1
        },
        "target_id": {
          "type": "string",
          "minLength": 1
        },
        "fields": {
          "type": "object",
          "properties": {
            "label": {
              "type": "string",
              "minLength": 1
            },
            "verb": {
              "type": "string",
              "minLength": 1
            }
          },
          "additionalProperties": false
        },
        "source_refs": {
          "type": "array",
          "items": {
            "type": "string",
            "minLength": 1
          },
          "uniqueItems": true
        },
        "review": {
          "type": "object",
          "properties": {
            "state": {
              "enum": [
                "proposed",
                "accepted",
                "partial",
                "under_review",
                "illustration"
              ]
            },
            "note": {
              "type": "string"
            }
          },
          "required": [
            "state",
            "note"
          ],
          "additionalProperties": false
        },
        "adoption_ids": {
          "type": "array",
          "items": {
            "type": "string",
            "minLength": 1
          },
          "uniqueItems": true
        },
        "qualification": {
          "type": "object",
          "properties": {
            "meaning": {
              "type": "string",
              "minLength": 1
            },
            "role": {
              "type": "string",
              "minLength": 1
            },
            "conditions": {
              "type": "array",
              "items": {
                "type": "string",
                "minLength": 1
              }
            },
            "effects": {
              "type": "array",
              "items": {
                "type": "string",
                "minLength": 1
              }
            },
            "scope": {
              "type": "string",
              "minLength": 1
            }
          },
          "required": [
            "meaning"
          ],
          "additionalProperties": false
        },
        "last_modified": {
          "type": "string",
          "pattern": "^\\d{4}-\\d{2}-\\d{2}T\\d{2}:\\d{2}:\\d{2}(\\.\\d+)?Z$"
        },
        "content_sha256": {
          "type": "string",
          "pattern": "^[0-9a-f]{64}$"
        },
        "lifecycle": {
          "$ref": "#/$defs/lifecycle"
        }
      },
      "required": [
        "id",
        "revision",
        "type",
        "source_id",
        "target_id",
        "source_refs",
        "review"
      ],
      "additionalProperties": false
    },
    "lifecycle": {
      "type": "object",
      "properties": {
        "state": {
          "enum": [
            "ai_proposed",
            "under_instruction",
            "urbanist_validated"
          ]
        },
        "recorded_at": {
          "type": "string",
          "pattern": "^\\d{4}-\\d{2}-\\d{2}T\\d{2}:\\d{2}:\\d{2}(\\.\\d+)?Z$"
        },
        "recorded_by": {
          "type": "string",
          "minLength": 1
        },
        "source_refs": {
          "type": "array",
          "items": {
            "type": "string",
            "minLength": 1
          },
          "minItems": 1,
          "uniqueItems": true
        },
        "validated_fields": {
          "type": "array",
          "items": {
            "type": "string",
            "minLength": 1
          },
          "uniqueItems": true
        },
        "value_sha256": {
          "type": "object",
          "additionalProperties": {
            "type": "string",
            "pattern": "^[0-9a-f]{64}$"
          }
        },
        "note": {
          "type": "string"
        }
      },
      "required": [
        "state",
        "recorded_at",
        "recorded_by",
        "source_refs",
        "validated_fields",
        "value_sha256",
        "note"
      ],
      "additionalProperties": false
    },
    "marketComparisons": {
      "type": "array",
      "minItems": 1,
      "items": {
        "type": "object",
        "properties": {
          "vendor": {
            "type": "string",
            "minLength": 1
          },
          "product": {
            "type": "string",
            "minLength": 1
          },
          "element_name": {
            "type": "string",
            "minLength": 1
          },
          "element_type": {
            "type": "string",
            "minLength": 1
          },
          "relationship": {
            "type": "string",
            "minLength": 1
          },
          "similarities": {
            "type": "string",
            "minLength": 1
          },
          "differences": {
            "type": "string",
            "minLength": 1
          },
          "flow_position": {
            "type": "string",
            "minLength": 1
          },
          "source_title": {
            "type": "string",
            "minLength": 1
          },
          "source_url": {
            "type": "string",
            "minLength": 1,
            "pattern": "^https?://[^\\s]+$"
          },
          "source_version": {
            "type": "string",
            "minLength": 1
          },
          "consulted_on": {
            "type": "string",
            "minLength": 1,
            "pattern": "^\\d{4}-\\d{2}-\\d{2}$"
          },
          "source_locator": {
            "type": "string",
            "minLength": 1
          },
          "evidence_limits": {
            "type": "string",
            "minLength": 1
          },
          "status": {
            "enum": [
              "proposed",
              "under_review",
              "validated"
            ]
          },
          "source_refs": {
            "type": "array",
            "minItems": 1,
            "uniqueItems": true,
            "items": {
              "type": "string",
              "minLength": 1
            }
          }
        },
        "required": [
          "vendor",
          "product",
          "element_name",
          "element_type",
          "relationship",
          "similarities",
          "differences",
          "flow_position",
          "source_title",
          "source_url",
          "source_version",
          "consulted_on",
          "source_locator",
          "evidence_limits",
          "status",
          "source_refs"
        ],
        "additionalProperties": false
      }
    }
  }
}
