{
  "schema_version": "1.0.0",
  "model_id": "flow-urbanism",
  "version": "2026-09-13.4",
  "as_of": "2026-09-13",
  "source_version": "P81 0.9 + P82/U116 + libellés P84/P86 retenus en U118 + séparation D01 U125 (vocabulaire U126 ouvert) + nom D01.g adopté U129",
  "source_files": [
    {
      "path": "connaissance/25-domaines-coeur-et-epreuve-recits.md",
      "sha256": "65841ecf1c8fd7abf61221af37c6f842a68ecc69aad11ee9e86cb40655ec32dd"
    },
    {
      "path": "connaissance/01-contributions-utilisateur.md",
      "sha256": "99fe4966faedd434d30b6aee3daa41d1bcc0b36b4914f539419da21acc6aa1e6"
    },
    {
      "path": "connaissance/04-corrections.md",
      "sha256": "bae7bbb709def2d75f763050f108c288f235a0e5c5d40392ebbbbb02bcba0fb8"
    },
    {
      "path": "connaissance/05-propositions.md",
      "sha256": "4ec2a903af2c14744ba8b2e83ba18acf8a7042126dcc480121774f28ab6c6a16"
    },
    {
      "path": "app/model-metadata.json",
      "sha256": "89ffdbf46ce58660b9e167863ea9f474976bb8f048fb9c52b53e612a5d5a6c11"
    },
    {
      "path": "app/exploration.json",
      "sha256": "dc3d99a5ac1ff4beb6794af10c16466a45e115ff9da3651ed816db1ac438c023"
    }
  ],
  "space": "release",
  "principles": [
    {
      "id": "PRINCIPLE-TWO-LAYERS",
      "statement": "Socle transactionnel et modèle processus distincts ; chacun possède ses objets, sa persistance et son urbanisation.",
      "source_refs": [
        "U18",
        "U19",
        "U20",
        "U49",
        "U50",
        "U62"
      ],
      "revision": 1,
      "last_modified": "2026-09-13T15:39:21.359705Z",
      "content_sha256": "2eff74ee15b64139872ef75cbd61b73e25d1178433231110530d09b1f7e7414d"
    },
    {
      "id": "PRINCIPLE-CAPABILITY",
      "statement": "Une capacité décrit ce que sait faire l’entreprise indépendamment de son organisation et de ses outils.",
      "source_refs": [
        "U33"
      ],
      "revision": 1,
      "last_modified": "2026-09-13T15:39:21.359705Z",
      "content_sha256": "8c62457d9da8dc7e2defc990f5f1e4efb3c1e5eaf51ff3dbc1138b58f508916b"
    },
    {
      "id": "PRINCIPLE-SUPPLY-DOCUMENTS",
      "statement": "Supply générique orientée documents d’autorisation ; les parcours commerciaux appartiennent au modèle processus.",
      "source_refs": [
        "U100"
      ],
      "revision": 1,
      "last_modified": "2026-09-13T15:39:21.359705Z",
      "content_sha256": "876694c80b423265ff73a38f9f588c9560acef7a44ce498acbcc4d9e92b95afd"
    },
    {
      "id": "PRINCIPLE-FLOW-LOGISTICS",
      "statement": "Logistique hors développement FLOW, en adhérence ; autonomie C-Log conservée.",
      "source_refs": [
        "U58"
      ],
      "revision": 1,
      "last_modified": "2026-09-13T15:39:21.359705Z",
      "content_sha256": "1be43e545fa8b13b1ec05e04e9dfa2f19a8144d0a950ff9c5e65fe6e7fbfeeec"
    },
    {
      "id": "PRINCIPLE-CTP-DEFERRED",
      "statement": "ATP associé à la promesse ; CTP conservé au glossaire et placement différé.",
      "source_refs": [
        "U95"
      ],
      "revision": 1,
      "last_modified": "2026-09-13T15:39:21.359705Z",
      "content_sha256": "481c6cd56381f236246f93dfc6781c9409400ab144e87b0b90b32ec92a6d75fd"
    },
    {
      "id": "PRINCIPLE-ORDER-AGREEMENT",
      "statement": "Commandes distinctes des Agreements de référence.",
      "source_refs": [
        "U98"
      ],
      "revision": 1,
      "last_modified": "2026-09-13T15:39:21.359705Z",
      "content_sha256": "3564bac9498b5f1a36db799cc5bb62633830dcf82ee38e80bc7eb42902e62eca"
    }
  ],
  "limitations": [
    "Les 36 capacités du modèle figé sont publiées ; la publication ne valide pas leurs définitions, noms ou rattachements.",
    "approved_fields et les décisions associées délimitent les aspects validés ; proposed_fields restent à valider.",
    "Les validations contextuelles restent partielles ; le réexamen du rattachement de Reservation demeure visible.",
    "Les alternatives non intégrées et les illustrations restent dans le backlog.",
    "Le modèle processus détaillé reste à construire ; les autorités et frontières ouvertes ne sont pas arbitrées par cette publication."
  ],
  "element_versioning": 1,
  "revision": 2,
  "content_sha256": "7700f1c59285e0f1f225b8eb3d75d441546a3f0b3a1a3d57c208c63bbd2b0714",
  "last_modified": "2026-09-13T16:25:42.581332Z",
  "release_kind": "published_snapshot",
  "publication": {
    "source_refs": [
      "U130"
    ],
    "note": "Publication complète demandée par Laurent ; publier ne vaut pas valider."
  },
  "nodes": [
    {
      "id": "business-references",
      "revision": 1,
      "kind": "group",
      "layer": "transactional",
      "fields": {
        "name": "Business References"
      },
      "source_refs": [
        "U103"
      ],
      "source_locator": {
        "path": "connaissance/25-domaines-coeur-et-epreuve-recits.md",
        "anchor": "business-references"
      },
      "review": {
        "state": "partial",
        "note": "Groupe de présentation, pas une capacité mère."
      },
      "last_modified": "2026-09-13T15:39:21.359705Z",
      "content_sha256": "d530da2dc4a0b2c03a83ba4f388483ea20d6176561f5b7978abec8fb045e6834",
      "adoption_ids": [
        "ADOPT-042"
      ],
      "approved_fields": [
        "name"
      ],
      "proposed_fields": []
    },
    {
      "id": "D01",
      "revision": 3,
      "kind": "domain",
      "layer": "transactional",
      "fields": {
        "name": "Inventory Management",
        "definition": "Connaître les stocks et les ressources attendues, expliquer leurs variations, fiabiliser les quantités et préserver les usages par les protections et réservations. Le stock futur est connu ici et mobilisé par Order Promising.",
        "finality": "Disposer d’une connaissance fiable des stocks physiques, de leurs états logiques et des ressources futures, préserver les usages retenus et enregistrer les quantités engagées.",
        "scope": "Stocks physiques, états logiques et connaissance des ressources futures ; disponibilité virtuelle pour la promesse dans Order Promising."
      },
      "source_refs": [
        "P81",
        "U66",
        "U74",
        "U75",
        "U78",
        "U79",
        "U80",
        "U81",
        "U86",
        "C58",
        "P82",
        "U116",
        "C71",
        "U125",
        "U126",
        "C73"
      ],
      "source_locator": {
        "path": "connaissance/25-domaines-coeur-et-epreuve-recits.md",
        "anchor": "d01-stocks",
        "line": 46
      },
      "review": {
        "state": "proposed",
        "note": "Aucune validation antérieure reprise pour cette révision ; aucune validation courante applicable enregistrée. Le statut éditorial du backlog ne constitue pas une preuve de validation. Note antérieure, qui ne qualifie pas cette révision : « Nom retenu en U66. Six capacités dans le backlog après séparation mouvements/état selon U125 ; noms et définitions détaillés proposés. La publication v001 conserve cinq capacités. Frontières détaillées et réservation à éprouver. »"
      },
      "editorial_basis": "Domain definition/finality: dated assistant summary from app/model-metadata.json, not independently approved.",
      "last_modified": "2026-09-13T16:25:42.581332Z",
      "content_sha256": "fe305d8f42239917fc42833cc8fd2148e89393503b5aa8a3999d6ad14f2e532d",
      "adoption_ids": [],
      "approved_fields": [],
      "proposed_fields": [
        "definition",
        "finality",
        "name",
        "scope"
      ]
    },
    {
      "id": "D01.f",
      "revision": 1,
      "kind": "capability",
      "layer": "transactional",
      "fields": {
        "name": "Inventory Tracking",
        "definition": "Établir et actualiser les quantités physiques et leurs états logiques à partir des faits de stock reconnus, par article, lieu, détenteur et propriétaire lorsque ces dimensions sont pertinentes ; suivre distinctement les ressources futures connues et leurs caractéristiques attendues.",
        "finality": "Disposer d’un état du stock à jour, expliqué par les faits reconnus, en distinguant présent et attendu."
      },
      "source_refs": [
        "U125",
        "U126",
        "C73",
        "P82",
        "CMP062",
        "ELM103",
        "ELM104",
        "ELM105"
      ],
      "source_locator": {
        "path": "connaissance/04-corrections.md",
        "anchor": "c73"
      },
      "review": {
        "state": "proposed",
        "note": "Scission de travail de D01.e selon U125. Définition et nom proposés ; aucune nouvelle validation métier. D01.e reste dans la publication historique v001."
      },
      "last_modified": "2026-09-13T16:25:42.581332Z",
      "content_sha256": "82d4cd14deb60774aadc210ac61f5bfd9ee78a5cf36c0d0bbf380e63d44c489d",
      "adoption_ids": [],
      "approved_fields": [],
      "proposed_fields": [
        "definition",
        "finality",
        "name"
      ]
    },
    {
      "id": "D01.g",
      "revision": 1,
      "kind": "capability",
      "layer": "transactional",
      "fields": {
        "name": "Record Inventory Movements",
        "definition": "Enregistrer, qualifier et conserver les mouvements de stock et leurs justifications : réceptions, sorties, transferts, changements d’état ou de propriété et ajustements justifiés ; identifier les quantités concernées, les dates et les références explicatives, y compris sans déplacement physique.",
        "finality": "Disposer d’un historique traçable des faits qui expliquent les variations du stock."
      },
      "source_refs": [
        "U125",
        "U126",
        "C73",
        "P82",
        "CMP062",
        "ELM103",
        "ELM104",
        "ELM105",
        "U127",
        "U129",
        "C74"
      ],
      "source_locator": {
        "path": "connaissance/04-corrections.md",
        "anchor": "c73"
      },
      "review": {
        "state": "partial",